[
  {
    "id": "0c9acb06-80bd-4f63-9e9f-8a10d8e06a7d",
    "name": "Roundover - 3/8\" Rad 1\" Dia x 1/2\" Deep",
    "tool_type": "8",
    "diameter_mm": 25.4,
    "flute_count": 2,
    "material": "Acrylic",
    "rpm_recommend": 10000,
    "feed_recommend_mm_per_min": 60,
    "stepover_percent": 0.15,
    "source": "C:\\ProgramData\\Vectric\\Aspire\\V12.0\\ToolDatabase\\tools.vtdb.vectric",
    "last_modified": "2026-02-25T10:47:10.327Z"
  },
  {
    "id": "105887a5-c687-4889-910b-db6f3f756d09",
    "name": "{Tool Type} ({Included Angle|.0}° - {Diameter|F}{Units Short})",
    "tool_type": "6",
    "diameter_mm": 6,
    "flute_count": 2,
    "material": "Acrylic",
    "rpm_recommend": 14000,
    "feed_recommend_mm_per_min": 0,
    "source": "C:\\ProgramData\\Vectric\\Aspire\\V12.0\\ToolDatabase\\tools.vtdb.vectric",
    "last_modified": "2026-02-25T10:47:10.328Z"
  },
  {
    "id": "12160df4-39ed-4e12-a9fd-608d969ef55a",
    "name": "{Tool Type} ({Diameter|F}{Units Short})",
    "tool_type": "0",
    "diameter_mm": 1.5,
    "flute_count": 2,
    "material": "Acrylic",
    "rpm_recommend": 18000,
    "feed_recommend_mm_per_min": 22860,
    "stepover_percent": 0.12,
    "source": "C:\\ProgramData\\Vectric\\Aspire\\V12.0\\ToolDatabase\\tools.vtdb.vectric",
    "last_modified": "2026-02-25T10:47:10.328Z"
  },
  {
    "id": "180b267f-7fc9-4b08-8c5b-27df0a1780ee",
    "name": "{Tool Type} ({Included Angle|.0}° - {Diameter|F}{Units Short})",
    "tool_type": "3",
    "diameter_mm": 12.7,
    "flute_count": 2,
    "material": "Acrylic",
    "rpm_recommend": 14000,
    "feed_recommend_mm_per_min": 30,
    "stepover_percent": 0.01,
    "source": "C:\\ProgramData\\Vectric\\Aspire\\V12.0\\ToolDatabase\\tools.vtdb.vectric",
    "last_modified": "2026-02-25T10:47:10.328Z"
  },
  {
    "id": "18dec22f-ba8b-4702-a482-aa8e3f6a32a0",
    "name": "{Tool Type} ({Included Angle|.0}° - {Diameter|F}{Units Short})",
    "tool_type": "6",
    "diameter_mm": 3,
    "flute_count": 2,
    "material": "Acrylic",
    "rpm_recommend": 14000,
    "feed_recommend_mm_per_min": 0,
    "source": "C:\\ProgramData\\Vectric\\Aspire\\V12.0\\ToolDatabase\\tools.vtdb.vectric",
    "last_modified": "2026-02-25T10:47:10.328Z"
  },
  {
    "id": "21f9d7eb-be55-43c7-b6b5-9457bbb6e1d3",
    "name": "{Tool Type} ({Diameter|F}{Units Short})",
    "tool_type": "1",
    "diameter_mm": 6,
    "flute_count": 2,
    "material": "Acrylic",
    "rpm_recommend": 10000,
    "feed_recommend_mm_per_min": 76200,
    "stepover_percent": 2.4000000000000004,
    "source": "C:\\ProgramData\\Vectric\\Aspire\\V12.0\\ToolDatabase\\tools.vtdb.vectric",
    "last_modified": "2026-02-25T10:47:10.328Z"
  },
  {
    "id": "23e8ebfb-3db6-413f-ba21-700661995a1d",
    "name": "{Tool Type} ({Included Angle|.0}° - {Diameter|F}{Units Short} - {Line Width}{Units Short} Line Width)",
    "tool_type": "9",
    "diameter_mm": 3.175,
    "material": "Acrylic",
    "rpm_recommend": 0,
    "feed_recommend_mm_per_min": 50,
    "stepover_percent": 0.0125,
    "source": "C:\\ProgramData\\Vectric\\Aspire\\V12.0\\ToolDatabase\\tools.vtdb.vectric",
    "last_modified": "2026-02-25T10:47:10.328Z"
  },
  {
    "id": "26212541-0e45-4ff7-8ccd-fb203b58fe6c",
    "name": "{Tool Type} ({Included Angle|.0}° - {Diameter|F}{Units Short})",
    "tool_type": "6",
    "diameter_mm": 3.175,
    "flute_count": 2,
    "material": "Acrylic",
    "rpm_recommend": 10000,
    "source": "C:\\ProgramData\\Vectric\\Aspire\\V12.0\\ToolDatabase\\tools.vtdb.vectric",
    "last_modified": "2026-02-25T10:47:10.328Z"
  },
  {
    "id": "28e3245a-79fe-4e18-94d6-23b7c1eac9f5",
    "name": "Ogee - 1/4\" Rads 1 1/4\" Dia 1/2\" Deep",
    "tool_type": "8",
    "diameter_mm": 31.75,
    "flute_count": 2,
    "material": "Acrylic",
    "rpm_recommend": 10000,
    "feed_recommend_mm_per_min": 60,
    "stepover_percent": 0.1875,
    "source": "C:\\ProgramData\\Vectric\\Aspire\\V12.0\\ToolDatabase\\tools.vtdb.vectric",
    "last_modified": "2026-02-25T10:47:10.328Z"
  },
  {
    "id": "44230771-834e-47a8-b2f2-d1c8de39d683",
    "name": "{Tool Type} ({Side Angle|.0}°, Tip {Flat Diameter} - {Diameter|F}{Units Short})",
    "tool_type": "4",
    "diameter_mm": 6.35,
    "flute_count": 1,
    "material": "Acrylic",
    "rpm_recommend": 10000,
    "feed_recommend_mm_per_min": 70,
    "stepover_percent": 0.0019999999552965165,
    "source": "C:\\ProgramData\\Vectric\\Aspire\\V12.0\\ToolDatabase\\tools.vtdb.vectric",
    "last_modified": "2026-02-25T10:47:10.328Z"
  },
  {
    "id": "4622bec3-4406-415b-87e1-2ebd21075dcc",
    "name": "{Tool Type} ({Diameter|F}{Units Short})",
    "tool_type": "1",
    "diameter_mm": 0.79375,
    "flute_count": 2,
    "material": "Acrylic",
    "rpm_recommend": 18000,
    "feed_recommend_mm_per_min": 25,
    "stepover_percent": 0.0078125,
    "source": "C:\\ProgramData\\Vectric\\Aspire\\V12.0\\ToolDatabase\\tools.vtdb.vectric",
    "last_modified": "2026-02-25T10:47:10.328Z"
  },
  {
    "id": "4c065674-20ee-4214-898c-58b93792b97f",
    "name": "{Tool Type} ({Side Angle|.0}°, Tip {Flat Diameter} - {Diameter|F}{Units Short})",
    "tool_type": "4",
    "diameter_mm": 6,
    "flute_count": 1,
    "material": "Acrylic",
    "rpm_recommend": 10000,
    "feed_recommend_mm_per_min": 45720,
    "stepover_percent": 0.05,
    "source": "C:\\ProgramData\\Vectric\\Aspire\\V12.0\\ToolDatabase\\tools.vtdb.vectric",
    "last_modified": "2026-02-25T10:47:10.328Z"
  },
  {
    "id": "54ae2afb-28db-4ba2-bc93-bb64e98b78e2",
    "name": "{Tool Type} ({Diameter|F}{Units Short})",
    "tool_type": "1",
    "diameter_mm": 1,
    "flute_count": 2,
    "material": "Acrylic",
    "rpm_recommend": 18000,
    "feed_recommend_mm_per_min": 17780,
    "stepover_percent": 0.25,
    "source": "C:\\ProgramData\\Vectric\\Aspire\\V12.0\\ToolDatabase\\tools.vtdb.vectric",
    "last_modified": "2026-02-25T10:47:10.328Z"
  },
  {
    "id": "560080b2-8324-4b14-8d25-dad54e0a14eb",
    "name": "{Tool Type} ({Included Angle|.0}° - {Diameter|F}{Units Short})",
    "tool_type": "3",
    "diameter_mm": 6.35,
    "flute_count": 2,
    "material": "Acrylic",
    "rpm_recommend": 10000,
    "feed_recommend_mm_per_min": 70,
    "stepover_percent": 0.005,
    "source": "C:\\ProgramData\\Vectric\\Aspire\\V12.0\\ToolDatabase\\tools.vtdb.vectric",
    "last_modified": "2026-02-25T10:47:10.328Z"
  },
  {
    "id": "5f786ec2-579a-43de-853b-02e1bbbcbfe3",
    "name": "{Tool Type} ({Included Angle|.0}° - {Diameter|F}{Units Short} - {Line Width}{Units Short} Line Width)",
    "tool_type": "9",
    "diameter_mm": 3,
    "material": "Acrylic",
    "rpm_recommend": 10000,
    "feed_recommend_mm_per_min": 32385,
    "stepover_percent": 0.30000000000000004,
    "source": "C:\\ProgramData\\Vectric\\Aspire\\V12.0\\ToolDatabase\\tools.vtdb.vectric",
    "last_modified": "2026-02-25T10:47:10.328Z"
  },
  {
    "id": "73861fdb-12d5-4622-8d11-6ba92b500030",
    "name": "{Tool Type} ({Diameter|F}{Units Short})",
    "tool_type": "1",
    "diameter_mm": 6.35,
    "flute_count": 2,
    "material": "Acrylic",
    "rpm_recommend": 10000,
    "feed_recommend_mm_per_min": 120,
    "stepover_percent": 0.1,
    "source": "C:\\ProgramData\\Vectric\\Aspire\\V12.0\\ToolDatabase\\tools.vtdb.vectric",
    "last_modified": "2026-02-25T10:47:10.328Z"
  },
  {
    "id": "78a54372-43ae-4688-9c3c-a0161b21b43c",
    "name": "{Tool Type} ({Included Angle|.0}° - {Diameter|F}{Units Short})",
    "tool_type": "3",
    "diameter_mm": 6,
    "flute_count": 2,
    "material": "Acrylic",
    "rpm_recommend": 10000,
    "feed_recommend_mm_per_min": 45720,
    "stepover_percent": 0.12,
    "source": "C:\\ProgramData\\Vectric\\Aspire\\V12.0\\ToolDatabase\\tools.vtdb.vectric",
    "last_modified": "2026-02-25T10:47:10.328Z"
  },
  {
    "id": "81d48546-b825-4395-b489-0bd1cccf588d",
    "name": "{Tool Type} ({Diameter|F}{Units Short})",
    "tool_type": "0",
    "diameter_mm": 6,
    "flute_count": 2,
    "material": "Acrylic",
    "rpm_recommend": 10000,
    "feed_recommend_mm_per_min": 76200,
    "stepover_percent": 0.48,
    "source": "C:\\ProgramData\\Vectric\\Aspire\\V12.0\\ToolDatabase\\tools.vtdb.vectric",
    "last_modified": "2026-02-25T10:47:10.328Z"
  },
  {
    "id": "8c64bdc7-a4ac-4111-9911-d690a409e8c9",
    "name": "{Tool Type} ({Side Angle|.0}°, Tip {Flat Diameter} - {Diameter|F}{Units Short})",
    "tool_type": "4",
    "diameter_mm": 3.175,
    "flute_count": 1,
    "material": "Acrylic",
    "rpm_recommend": 10000,
    "feed_recommend_mm_per_min": 50,
    "stepover_percent": 0.001,
    "source": "C:\\ProgramData\\Vectric\\Aspire\\V12.0\\ToolDatabase\\tools.vtdb.vectric",
    "last_modified": "2026-02-25T10:47:10.328Z"
  },
  {
    "id": "8dd3c0d8-30fe-424e-bec0-1a1667321983",
    "name": "{Tool Type} ({Included Angle|.0}° - {Diameter|F}{Units Short})",
    "tool_type": "3",
    "diameter_mm": 12.7,
    "flute_count": 2,
    "material": "Acrylic",
    "rpm_recommend": 10000,
    "feed_recommend_mm_per_min": 80,
    "stepover_percent": 0.01,
    "source": "C:\\ProgramData\\Vectric\\Aspire\\V12.0\\ToolDatabase\\tools.vtdb.vectric",
    "last_modified": "2026-02-25T10:47:10.328Z"
  },
  {
    "id": "8e0c4086-367b-461e-89ed-eed2ae7dacb1",
    "name": "{Tool Type} ({Diameter|F}{Units Short})",
    "tool_type": "1",
    "diameter_mm": 1.5,
    "flute_count": 2,
    "material": "Acrylic",
    "rpm_recommend": 18000,
    "feed_recommend_mm_per_min": 22860,
    "stepover_percent": 0.44999999999999996,
    "source": "C:\\ProgramData\\Vectric\\Aspire\\V12.0\\ToolDatabase\\tools.vtdb.vectric",
    "last_modified": "2026-02-25T10:47:10.328Z"
  },
  {
    "id": "8eb19ce0-34c1-4841-a478-c6a8cf59d155",
    "name": "{Tool Type} ({Included Angle|.0}° - {Diameter|F}{Units Short})",
    "tool_type": "6",
    "diameter_mm": 6.35,
    "flute_count": 2,
    "material": "Acrylic",
    "rpm_recommend": 10000,
    "source": "C:\\ProgramData\\Vectric\\Aspire\\V12.0\\ToolDatabase\\tools.vtdb.vectric",